{
  "schema": "@baron1996/drawing-document",
  "version": 1,
  "scopeKey": "fixture-instrument-000001",
  "coordinateSystem": {
    "timezone": "Asia/Shanghai",
    "valueAxes": [
      {
        "paneRole": "candle",
        "yAxisRole": "primary",
        "valuePrecision": 2
      }
    ]
  },
  "drawings": [
    {
      "id": "drawing-horizontalStraightLine-1",
      "target": {
        "paneRole": "candle",
        "yAxisRole": "primary"
      },
      "visible": true,
      "locked": false,
      "zLevel": 0,
      "mode": "normal",
      "styles": {
        "line": {
          "color": "rgba(41, 98, 255, 1)",
          "size": 1,
          "style": "solid"
        },
        "fill": {
          "color": "rgba(41, 98, 255, 0.15)"
        },
        "text": {
          "color": "rgba(255, 255, 255, 1)",
          "size": 12,
          "family": "Baron Sans",
          "weight": "normal",
          "backgroundColor": "rgba(41, 98, 255, 1)",
          "borderColor": "rgba(41, 98, 255, 1)"
        }
      },
      "metadata": {},
      "type": "horizontalStraightLine",
      "geometry": {
        "value": 12.55
      }
    },
    {
      "id": "drawing-priceLine-2",
      "target": {
        "paneRole": "candle",
        "yAxisRole": "primary"
      },
      "visible": true,
      "locked": false,
      "zLevel": 1,
      "mode": "normal",
      "styles": {
        "line": {
          "color": "rgba(41, 98, 255, 1)",
          "size": 1,
          "style": "solid"
        },
        "fill": {
          "color": "rgba(41, 98, 255, 0.15)"
        },
        "text": {
          "color": "rgba(255, 255, 255, 1)",
          "size": 12,
          "family": "Baron Sans",
          "weight": "normal",
          "backgroundColor": "rgba(41, 98, 255, 1)",
          "borderColor": "rgba(41, 98, 255, 1)"
        }
      },
      "metadata": {},
      "type": "priceLine",
      "geometry": {
        "value": 12.55
      }
    },
    {
      "id": "drawing-simpleTag-3",
      "target": {
        "paneRole": "candle",
        "yAxisRole": "primary"
      },
      "visible": true,
      "locked": false,
      "zLevel": 2,
      "mode": "normal",
      "styles": {
        "line": {
          "color": "rgba(41, 98, 255, 1)",
          "size": 1,
          "style": "solid"
        },
        "fill": {
          "color": "rgba(41, 98, 255, 0.15)"
        },
        "text": {
          "color": "rgba(255, 255, 255, 1)",
          "size": 12,
          "family": "Baron Sans",
          "weight": "normal",
          "backgroundColor": "rgba(41, 98, 255, 1)",
          "borderColor": "rgba(41, 98, 255, 1)"
        }
      },
      "metadata": {},
      "type": "simpleTag",
      "geometry": {
        "value": 12.55,
        "text": "tag"
      }
    },
    {
      "id": "drawing-verticalStraightLine-4",
      "target": {
        "paneRole": "candle",
        "yAxisRole": "primary"
      },
      "visible": true,
      "locked": false,
      "zLevel": 3,
      "mode": "normal",
      "styles": {
        "line": {
          "color": "rgba(41, 98, 255, 1)",
          "size": 1,
          "style": "solid"
        },
        "fill": {
          "color": "rgba(41, 98, 255, 0.15)"
        },
        "text": {
          "color": "rgba(255, 255, 255, 1)",
          "size": 12,
          "family": "Baron Sans",
          "weight": "normal",
          "backgroundColor": "rgba(41, 98, 255, 1)",
          "borderColor": "rgba(41, 98, 255, 1)"
        }
      },
      "metadata": {},
      "type": "verticalStraightLine",
      "geometry": {
        "time": 1784736000000
      }
    },
    {
      "id": "drawing-horizontalRayLine-5",
      "target": {
        "paneRole": "candle",
        "yAxisRole": "primary"
      },
      "visible": true,
      "locked": false,
      "zLevel": 4,
      "mode": "normal",
      "styles": {
        "line": {
          "color": "rgba(41, 98, 255, 1)",
          "size": 1,
          "style": "solid"
        },
        "fill": {
          "color": "rgba(41, 98, 255, 0.15)"
        },
        "text": {
          "color": "rgba(255, 255, 255, 1)",
          "size": 12,
          "family": "Baron Sans",
          "weight": "normal",
          "backgroundColor": "rgba(41, 98, 255, 1)",
          "borderColor": "rgba(41, 98, 255, 1)"
        }
      },
      "metadata": {},
      "type": "horizontalRayLine",
      "geometry": {
        "value": 12.55,
        "startTime": 1784736000000,
        "endTime": 1784908800000
      }
    },
    {
      "id": "drawing-horizontalSegment-6",
      "target": {
        "paneRole": "candle",
        "yAxisRole": "primary"
      },
      "visible": true,
      "locked": false,
      "zLevel": 5,
      "mode": "normal",
      "styles": {
        "line": {
          "color": "rgba(41, 98, 255, 1)",
          "size": 1,
          "style": "solid"
        },
        "fill": {
          "color": "rgba(41, 98, 255, 0.15)"
        },
        "text": {
          "color": "rgba(255, 255, 255, 1)",
          "size": 12,
          "family": "Baron Sans",
          "weight": "normal",
          "backgroundColor": "rgba(41, 98, 255, 1)",
          "borderColor": "rgba(41, 98, 255, 1)"
        }
      },
      "metadata": {},
      "type": "horizontalSegment",
      "geometry": {
        "value": 12.55,
        "startTime": 1784736000000,
        "endTime": 1784908800000
      }
    },
    {
      "id": "drawing-verticalRayLine-7",
      "target": {
        "paneRole": "candle",
        "yAxisRole": "primary"
      },
      "visible": true,
      "locked": false,
      "zLevel": 6,
      "mode": "normal",
      "styles": {
        "line": {
          "color": "rgba(41, 98, 255, 1)",
          "size": 1,
          "style": "solid"
        },
        "fill": {
          "color": "rgba(41, 98, 255, 0.15)"
        },
        "text": {
          "color": "rgba(255, 255, 255, 1)",
          "size": 12,
          "family": "Baron Sans",
          "weight": "normal",
          "backgroundColor": "rgba(41, 98, 255, 1)",
          "borderColor": "rgba(41, 98, 255, 1)"
        }
      },
      "metadata": {},
      "type": "verticalRayLine",
      "geometry": {
        "time": 1784822400000,
        "startValue": 12.34,
        "endValue": 12.74
      }
    },
    {
      "id": "drawing-verticalSegment-8",
      "target": {
        "paneRole": "candle",
        "yAxisRole": "primary"
      },
      "visible": true,
      "locked": false,
      "zLevel": 7,
      "mode": "normal",
      "styles": {
        "line": {
          "color": "rgba(41, 98, 255, 1)",
          "size": 1,
          "style": "solid"
        },
        "fill": {
          "color": "rgba(41, 98, 255, 0.15)"
        },
        "text": {
          "color": "rgba(255, 255, 255, 1)",
          "size": 12,
          "family": "Baron Sans",
          "weight": "normal",
          "backgroundColor": "rgba(41, 98, 255, 1)",
          "borderColor": "rgba(41, 98, 255, 1)"
        }
      },
      "metadata": {},
      "type": "verticalSegment",
      "geometry": {
        "time": 1784822400000,
        "startValue": 12.34,
        "endValue": 12.74
      }
    },
    {
      "id": "drawing-rayLine-9",
      "target": {
        "paneRole": "candle",
        "yAxisRole": "primary"
      },
      "visible": true,
      "locked": false,
      "zLevel": 8,
      "mode": "normal",
      "styles": {
        "line": {
          "color": "rgba(41, 98, 255, 1)",
          "size": 1,
          "style": "solid"
        },
        "fill": {
          "color": "rgba(41, 98, 255, 0.15)"
        },
        "text": {
          "color": "rgba(255, 255, 255, 1)",
          "size": 12,
          "family": "Baron Sans",
          "weight": "normal",
          "backgroundColor": "rgba(41, 98, 255, 1)",
          "borderColor": "rgba(41, 98, 255, 1)"
        }
      },
      "metadata": {},
      "type": "rayLine",
      "geometry": {
        "points": [
          {
            "timestamp": 1784736000000,
            "granularity": {
              "type": "day",
              "span": 1
            },
            "value": 12.34
          },
          {
            "timestamp": 1784908800000,
            "granularity": {
              "type": "day",
              "span": 1
            },
            "value": 12.74
          }
        ]
      }
    },
    {
      "id": "drawing-segment-10",
      "target": {
        "paneRole": "candle",
        "yAxisRole": "primary"
      },
      "visible": true,
      "locked": false,
      "zLevel": 9,
      "mode": "normal",
      "styles": {
        "line": {
          "color": "rgba(41, 98, 255, 1)",
          "size": 1,
          "style": "solid"
        },
        "fill": {
          "color": "rgba(41, 98, 255, 0.15)"
        },
        "text": {
          "color": "rgba(255, 255, 255, 1)",
          "size": 12,
          "family": "Baron Sans",
          "weight": "normal",
          "backgroundColor": "rgba(41, 98, 255, 1)",
          "borderColor": "rgba(41, 98, 255, 1)"
        }
      },
      "metadata": {},
      "type": "segment",
      "geometry": {
        "points": [
          {
            "timestamp": 1784736000000,
            "granularity": {
              "type": "day",
              "span": 1
            },
            "value": 12.34
          },
          {
            "timestamp": 1784908800000,
            "granularity": {
              "type": "day",
              "span": 1
            },
            "value": 12.74
          }
        ]
      }
    },
    {
      "id": "drawing-straightLine-11",
      "target": {
        "paneRole": "candle",
        "yAxisRole": "primary"
      },
      "visible": true,
      "locked": false,
      "zLevel": 10,
      "mode": "normal",
      "styles": {
        "line": {
          "color": "rgba(41, 98, 255, 1)",
          "size": 1,
          "style": "solid"
        },
        "fill": {
          "color": "rgba(41, 98, 255, 0.15)"
        },
        "text": {